{
  "record_type":"ranking_family_inventory",
  "schema_version":"v1",
  "inventory_id":"us-news-ranking-family-inventory-2026-best-colleges-v1",
  "discovery_date":"2026-07-10",
  "families":[
    {"canonical_family_id":"national-universities","official_display_name":"National Universities","ranking_family":"national_universities","edition":"2026 Best Colleges","publication_date":"2025-09-23","inclusion_status":"included","inclusion_reason":"Scope A: numeric rank at or below 50","exclusion_reason":null,"source_ids":["usn-2026-best-colleges-press-release","usn-best-colleges-ranking-pages"],"accessibility_status":"needs_manual_seed","last_verified_at":"2026-07-10T00:00:00Z"},
    {"canonical_family_id":"national-liberal-arts-colleges","official_display_name":"National Liberal Arts Colleges","ranking_family":"national_liberal_arts","edition":"2026 Best Colleges","publication_date":"2025-09-23","inclusion_status":"excluded","inclusion_reason":null,"exclusion_reason":"Not Scope A; institutions may still enter through an included undergraduate program category","source_ids":["usn-2026-best-colleges-press-release"],"accessibility_status":"partially_public","last_verified_at":"2026-07-10T00:00:00Z"},
    {"canonical_family_id":"regional-universities","official_display_name":"Best Regional Universities","ranking_family":"regional_universities","edition":"2026 Best Colleges","publication_date":"2025-09-23","inclusion_status":"excluded","inclusion_reason":null,"exclusion_reason":"Not Scope A; institutions may still enter through an included undergraduate program category","source_ids":["usn-2026-best-colleges-press-release"],"accessibility_status":"partially_public","last_verified_at":"2026-07-10T00:00:00Z"},
    {"canonical_family_id":"regional-colleges","official_display_name":"Regional Colleges","ranking_family":"regional_colleges","edition":"2026 Best Colleges","publication_date":"2025-09-23","inclusion_status":"excluded","inclusion_reason":null,"exclusion_reason":"Not Scope A; institutions may still enter through an included undergraduate program category","source_ids":["usn-2026-best-colleges-press-release"],"accessibility_status":"partially_public","last_verified_at":"2026-07-10T00:00:00Z"},
    {"canonical_family_id":"undergraduate-academic-programs","official_display_name":"Undergraduate Academic Program and Subject Rankings","ranking_family":"undergraduate_program","edition":"2026 Best Colleges","publication_date":"2025-09-23","inclusion_status":"included","inclusion_reason":"Scope B: included undergraduate program/subject/specialty categories at numeric rank at or below 20","exclusion_reason":null,"source_ids":["usn-2026-best-colleges-press-release","asu-2026-business-crosscheck","gatech-2026-engineering-crosscheck"],"accessibility_status":"needs_manual_seed","last_verified_at":"2026-07-10T00:00:00Z"},
    {"canonical_family_id":"best-global-universities","official_display_name":"Best Global Universities","ranking_family":"global_universities","edition":"2025-2026 Best Global Universities","publication_date":null,"inclusion_status":"excluded","inclusion_reason":null,"exclusion_reason":"Global research ranking is not a U.S. undergraduate admissions ranking","source_ids":["usn-best-global-universities-page"],"accessibility_status":"blocked","last_verified_at":"2026-07-10T00:00:00Z"},
    {"canonical_family_id":"best-graduate-schools","official_display_name":"Best Graduate Schools","ranking_family":"graduate_program","edition":"2026 Best Graduate Schools","publication_date":null,"inclusion_status":"excluded","inclusion_reason":null,"exclusion_reason":"Graduate programs are outside the current undergraduate canonical scope","source_ids":["usn-best-graduate-schools-page"],"accessibility_status":"blocked","last_verified_at":"2026-07-10T00:00:00Z"},
    {"canonical_family_id":"best-online-programs","official_display_name":"Best Online Programs","ranking_family":"online_program","edition":"2026 Best Online Programs","publication_date":"2026-01-27","inclusion_status":"excluded","inclusion_reason":null,"exclusion_reason":"Online-program methodology and population are outside this on-campus undergraduate scope","source_ids":["usn-2026-online-programs-press-release"],"accessibility_status":"publicly_accessible","last_verified_at":"2026-07-10T00:00:00Z"},
    {"canonical_family_id":"best-colleges-institutional-specialties","official_display_name":"Best Colleges Institutional and Experience Categories","ranking_family":"institutional_specialty","edition":"2026 Best Colleges","publication_date":"2025-09-23","inclusion_status":"excluded","inclusion_reason":null,"exclusion_reason":"Value, public-school, veterans, social mobility, innovation and experience lists are not academic program/subject rankings","source_ids":["usn-2026-best-colleges-press-release","hope-2026-best-colleges-crosscheck"],"accessibility_status":"partially_public","last_verified_at":"2026-07-10T00:00:00Z"}
  ]
}
